{
  "schema": "realm.tile_specs_index.v2",
  "generated_by": "scripts/export_tile_specs.py",
  "schema_version": 2,
  "compatibility": {
    "reads_v1": true,
    "writes_v2": true,
    "legacy_groups": {
      "ammunition": "projectiles"
    }
  },
  "groups": {
    "grounds": [
      {
        "enum": "G_GRASS",
        "name": "Grass",
        "slug": "grass",
        "path": "grounds/grass.json"
      },
      {
        "enum": "G_MEADOW",
        "name": "Meadow",
        "slug": "meadow",
        "path": "grounds/meadow.json"
      },
      {
        "enum": "G_DIRT",
        "name": "Dirt",
        "slug": "dirt",
        "path": "grounds/dirt.json"
      },
      {
        "enum": "G_ROAD",
        "name": "Road",
        "slug": "road",
        "path": "grounds/road.json"
      },
      {
        "enum": "G_MUD",
        "name": "Mud",
        "slug": "mud",
        "path": "grounds/mud.json"
      },
      {
        "enum": "G_SAND",
        "name": "Sand",
        "slug": "sand",
        "path": "grounds/sand.json"
      },
      {
        "enum": "G_DUNES",
        "name": "Dunes",
        "slug": "dunes",
        "path": "grounds/dunes.json"
      },
      {
        "enum": "G_SNOW",
        "name": "Snow",
        "slug": "snow",
        "path": "grounds/snow.json"
      },
      {
        "enum": "G_TUNDRA",
        "name": "Tundra",
        "slug": "tundra",
        "path": "grounds/tundra.json"
      },
      {
        "enum": "G_ICE",
        "name": "Ice",
        "slug": "ice",
        "path": "grounds/ice.json"
      },
      {
        "enum": "G_WATER",
        "name": "Water",
        "slug": "water",
        "path": "grounds/water.json"
      },
      {
        "enum": "G_SHALLOWS",
        "name": "Shallows",
        "slug": "shallows",
        "path": "grounds/shallows.json"
      },
      {
        "enum": "G_MARSH",
        "name": "Marsh",
        "slug": "marsh",
        "path": "grounds/marsh.json"
      },
      {
        "enum": "G_GRAVEL",
        "name": "Gravel",
        "slug": "gravel",
        "path": "grounds/gravel.json"
      },
      {
        "enum": "G_ASH",
        "name": "Ash",
        "slug": "ash",
        "path": "grounds/ash.json"
      },
      {
        "enum": "G_LAVA",
        "name": "Lava",
        "slug": "lava",
        "path": "grounds/lava.json"
      },
      {
        "enum": "G_HILLS",
        "name": "Hills",
        "slug": "hills",
        "path": "grounds/hills.json"
      },
      {
        "enum": "G_ROCKY",
        "name": "Rocky",
        "slug": "rocky",
        "path": "grounds/rocky.json"
      },
      {
        "enum": "G_CASTLE_FLOOR",
        "name": "Castle Floor",
        "slug": "castle_floor",
        "path": "grounds/castle_floor.json"
      }
    ],
    "features": [
      {
        "enum": "F_FOREST",
        "name": "Forest",
        "slug": "forest",
        "path": "features/forest.json"
      },
      {
        "enum": "F_PINE",
        "name": "Pine",
        "slug": "pine",
        "path": "features/pine.json"
      },
      {
        "enum": "F_PALM",
        "name": "Palm",
        "slug": "palm",
        "path": "features/palm.json"
      },
      {
        "enum": "F_DEAD_TREE",
        "name": "Dead Tree",
        "slug": "dead_tree",
        "path": "features/dead_tree.json"
      },
      {
        "enum": "F_BERRY_BUSH",
        "name": "Berry Bush",
        "slug": "berry_bush",
        "path": "features/berry_bush.json"
      },
      {
        "enum": "F_WHEAT_CROP",
        "name": "Wheat Crop",
        "slug": "wheat_crop",
        "path": "features/wheat_crop.json"
      },
      {
        "enum": "F_FISH_SHOAL",
        "name": "Fish Shoal",
        "slug": "fish_shoal",
        "path": "features/fish_shoal.json"
      },
      {
        "enum": "F_GOLD_DEPOSIT",
        "name": "Gold Deposit",
        "slug": "gold_deposit",
        "path": "features/gold_deposit.json"
      },
      {
        "enum": "F_STONE_BOULDERS",
        "name": "Stone Boulders",
        "slug": "stone_boulders",
        "path": "features/stone_boulders.json"
      },
      {
        "enum": "F_MOUNTAIN_PEAK",
        "name": "Mountain Peak",
        "slug": "mountain_peak",
        "path": "features/mountain_peak.json"
      },
      {
        "enum": "F_REEDS",
        "name": "Reeds",
        "slug": "reeds",
        "path": "features/reeds.json"
      },
      {
        "enum": "F_RUINS",
        "name": "Ruins",
        "slug": "ruins",
        "path": "features/ruins.json"
      },
      {
        "enum": "F_CASTLE_WALL",
        "name": "Castle Wall",
        "slug": "castle_wall",
        "path": "features/castle_wall.json"
      },
      {
        "enum": "F_CASTLE_GATE",
        "name": "Castle Gate",
        "slug": "castle_gate",
        "path": "features/castle_gate.json"
      }
    ],
    "decals": [
      {
        "enum": "VD_ROAD",
        "name": "Road",
        "slug": "road",
        "path": "decals/road.json"
      },
      {
        "enum": "VD_FLOWERS",
        "name": "Flowers",
        "slug": "flowers",
        "path": "decals/flowers.json"
      },
      {
        "enum": "VD_TALL_GRASS",
        "name": "Tall Grass",
        "slug": "tall_grass",
        "path": "decals/tall_grass.json"
      },
      {
        "enum": "VD_SCUFFS",
        "name": "Scuffs",
        "slug": "scuffs",
        "path": "decals/scuffs.json"
      },
      {
        "enum": "VD_PACKED_PATH",
        "name": "Packed Path",
        "slug": "packed_path",
        "path": "decals/packed_path.json"
      },
      {
        "enum": "VD_COBBLE_PATCH",
        "name": "Cobble Patch",
        "slug": "cobble_patch",
        "path": "decals/cobble_patch.json"
      },
      {
        "enum": "VD_WHEEL_RUTS",
        "name": "Wheel Ruts",
        "slug": "wheel_ruts",
        "path": "decals/wheel_ruts.json"
      },
      {
        "enum": "VD_YARD_CLUTTER",
        "name": "Yard Clutter",
        "slug": "yard_clutter",
        "path": "decals/yard_clutter.json"
      },
      {
        "enum": "VD_CRATES_BARRELS",
        "name": "Crates Barrels",
        "slug": "crates_barrels",
        "path": "decals/crates_barrels.json"
      },
      {
        "enum": "VD_LOG_PILES",
        "name": "Log Piles",
        "slug": "log_piles",
        "path": "decals/log_piles.json"
      },
      {
        "enum": "VD_FARM_TRACKS",
        "name": "Farm Tracks",
        "slug": "farm_tracks",
        "path": "decals/farm_tracks.json"
      },
      {
        "enum": "VD_MUDDY_FOOTPRINTS",
        "name": "Muddy Footprints",
        "slug": "muddy_footprints",
        "path": "decals/muddy_footprints.json"
      },
      {
        "enum": "VD_SNOW_TRAMPLED_PATH",
        "name": "Snow Trampled Path",
        "slug": "snow_trampled_path",
        "path": "decals/snow_trampled_path.json"
      }
    ],
    "units": [
      {
        "enum": "E_PEASANT",
        "name": "Peasant",
        "slug": "peasant",
        "path": "units/peasant.json"
      },
      {
        "enum": "E_MILITIA",
        "name": "Militia",
        "slug": "militia",
        "path": "units/militia.json"
      },
      {
        "enum": "E_ARCHER",
        "name": "Archer",
        "slug": "archer",
        "path": "units/archer.json"
      },
      {
        "enum": "E_KNIGHT",
        "name": "Knight",
        "slug": "knight",
        "path": "units/knight.json"
      },
      {
        "enum": "E_SPEARMAN",
        "name": "Spearman",
        "slug": "spearman",
        "path": "units/spearman.json"
      },
      {
        "enum": "E_CATAPULT",
        "name": "Catapult",
        "slug": "catapult",
        "path": "units/catapult.json"
      },
      {
        "enum": "E_TREBUCHET",
        "name": "Trebuchet",
        "slug": "trebuchet",
        "path": "units/trebuchet.json"
      },
      {
        "enum": "E_FISHING_BOAT",
        "name": "Fishing Boat",
        "slug": "fishing_boat",
        "path": "units/fishing_boat.json"
      },
      {
        "enum": "E_WARSHIP",
        "name": "Warship",
        "slug": "warship",
        "path": "units/warship.json"
      },
      {
        "enum": "E_TRANSPORT",
        "name": "Transport",
        "slug": "transport",
        "path": "units/transport.json"
      },
      {
        "enum": "E_RAM",
        "name": "Ram",
        "slug": "ram",
        "path": "units/ram.json"
      }
    ],
    "animals": [
      {
        "enum": "E_DEER",
        "name": "Deer",
        "slug": "deer",
        "path": "animals/deer.json"
      },
      {
        "enum": "E_WOLF",
        "name": "Wolf",
        "slug": "wolf",
        "path": "animals/wolf.json"
      },
      {
        "enum": "E_SHEEP",
        "name": "Sheep",
        "slug": "sheep",
        "path": "animals/sheep.json"
      },
      {
        "enum": "E_BOAR",
        "name": "Boar",
        "slug": "boar",
        "path": "animals/boar.json"
      }
    ],
    "buildings": [
      {
        "enum": "E_TOWNHALL",
        "name": "Town Hall",
        "slug": "town_hall",
        "path": "buildings/town_hall.json"
      },
      {
        "enum": "E_HOUSE",
        "name": "House",
        "slug": "house",
        "path": "buildings/house.json"
      },
      {
        "enum": "E_BARRACKS",
        "name": "Barracks",
        "slug": "barracks",
        "path": "buildings/barracks.json"
      },
      {
        "enum": "E_STABLE",
        "name": "Stable",
        "slug": "stable",
        "path": "buildings/stable.json"
      },
      {
        "enum": "E_TOWER",
        "name": "Tower",
        "slug": "tower",
        "path": "buildings/tower.json"
      },
      {
        "enum": "E_FARM",
        "name": "Farm",
        "slug": "farm",
        "path": "buildings/farm.json"
      },
      {
        "enum": "E_BLACKSMITH",
        "name": "Blacksmith",
        "slug": "blacksmith",
        "path": "buildings/blacksmith.json"
      },
      {